[
  {
    "code": "ENG-001",
    "title": "Software Engineer",
    "department": "Engineering",
    "description": "Design, develop, and maintain software applications. Work with cross-functional teams to deliver high-quality products.",
    "requirements": "- 3+ years of software development experience\n- Proficiency in at least one programming language (Python, JavaScript, Java, etc.)\n- Experience with version control (Git)\n- Strong problem-solving skills\n- Excellent communication abilities",
    "skills": ["JavaScript", "Python", "React", "Node.js", "SQL", "Git", "API Design", "Testing"],
    "experienceMin": 3,
    "experienceMax": 7,
    "educationLevel": "Bachelor's in Computer Science or related field",
    "salaryMin": 80000,
    "salaryMax": 130000
  },
  {
    "code": "ENG-002",
    "title": "Senior Software Engineer",
    "department": "Engineering",
    "description": "Lead technical initiatives and mentor junior engineers. Design scalable systems and drive engineering best practices.",
    "requirements": "- 5+ years of software development experience\n- Experience leading technical projects\n- Strong system design skills\n- Mentorship experience\n- Track record of delivering complex features",
    "skills": ["System Design", "JavaScript", "Python", "Cloud Architecture", "Leadership", "Code Review", "CI/CD", "Microservices"],
    "experienceMin": 5,
    "experienceMax": 10,
    "educationLevel": "Bachelor's in Computer Science or related field",
    "salaryMin": 120000,
    "salaryMax": 180000
  },
  {
    "code": "HR-001",
    "title": "HR Coordinator",
    "department": "Human Resources",
    "description": "Support HR operations including recruiting, onboarding, and employee relations. Maintain HR systems and documentation.",
    "requirements": "- 1+ years HR experience\n- Knowledge of HR policies and procedures\n- Strong organizational skills\n- Proficiency with HRIS systems\n- Excellent interpersonal skills",
    "skills": ["HRIS", "Recruiting", "Onboarding", "Employee Relations", "Microsoft Office", "Communication", "Organization"],
    "experienceMin": 1,
    "experienceMax": 3,
    "educationLevel": "Bachelor's in Human Resources, Business, or related field",
    "salaryMin": 45000,
    "salaryMax": 60000
  },
  {
    "code": "MKT-001",
    "title": "Marketing Manager",
    "department": "Marketing",
    "description": "Develop and execute marketing strategies. Manage campaigns across digital and traditional channels. Analyze performance and optimize ROI.",
    "requirements": "- 4+ years marketing experience\n- Experience with digital marketing channels\n- Data-driven decision making\n- Budget management\n- Team leadership",
    "skills": ["Digital Marketing", "SEO", "Content Strategy", "Analytics", "Campaign Management", "Budget Management", "Team Leadership", "Copywriting"],
    "experienceMin": 4,
    "experienceMax": 8,
    "educationLevel": "Bachelor's in Marketing, Communications, or related field",
    "salaryMin": 75000,
    "salaryMax": 110000
  },
  {
    "code": "SALES-001",
    "title": "Account Executive",
    "department": "Sales",
    "description": "Drive revenue by acquiring new customers and expanding existing accounts. Manage full sales cycle from prospecting to close.",
    "requirements": "- 2+ years B2B sales experience\n- Track record of meeting quotas\n- CRM proficiency (Salesforce preferred)\n- Strong presentation skills\n- Hunter mentality",
    "skills": ["B2B Sales", "Prospecting", "Negotiation", "CRM", "Presentation", "Relationship Building", "Pipeline Management"],
    "experienceMin": 2,
    "experienceMax": 5,
    "educationLevel": "Bachelor's degree",
    "salaryMin": 60000,
    "salaryMax": 85000
  },
  {
    "code": "CS-001",
    "title": "Customer Success Manager",
    "department": "Customer Success",
    "description": "Ensure customer satisfaction and retention. Onboard new customers, drive adoption, and identify expansion opportunities.",
    "requirements": "- 2+ years customer success or account management\n- Strong customer empathy\n- Data analysis skills\n- Project management abilities\n- Technical aptitude",
    "skills": ["Customer Success", "Account Management", "Onboarding", "Data Analysis", "Communication", "Problem Solving", "Product Knowledge"],
    "experienceMin": 2,
    "experienceMax": 5,
    "educationLevel": "Bachelor's degree",
    "salaryMin": 55000,
    "salaryMax": 80000
  },
  {
    "code": "OPS-001",
    "title": "Operations Analyst",
    "department": "Operations",
    "description": "Analyze business processes and identify improvement opportunities. Create reports, track KPIs, and support operational decision-making.",
    "requirements": "- 1+ years operations or analytics experience\n- Strong Excel/spreadsheet skills\n- SQL knowledge preferred\n- Process improvement mindset\n- Attention to detail",
    "skills": ["Data Analysis", "Excel", "SQL", "Process Improvement", "Reporting", "KPI Tracking", "Problem Solving"],
    "experienceMin": 1,
    "experienceMax": 4,
    "educationLevel": "Bachelor's in Business, Analytics, or related field",
    "salaryMin": 50000,
    "salaryMax": 70000
  },
  {
    "code": "FIN-001",
    "title": "Financial Analyst",
    "department": "Finance",
    "description": "Support financial planning and analysis. Create forecasts, analyze variances, and provide insights to leadership.",
    "requirements": "- 2+ years financial analysis experience\n- Advanced Excel and financial modeling\n- Experience with financial systems (NetSuite, SAP)\n- Strong analytical skills\n- CPA or CFA preferred",
    "skills": ["Financial Modeling", "Excel", "Forecasting", "Variance Analysis", "Financial Reporting", "Budgeting", "ERP Systems"],
    "experienceMin": 2,
    "experienceMax": 5,
    "educationLevel": "Bachelor's in Finance, Accounting, or related field",
    "salaryMin": 65000,
    "salaryMax": 95000
  }
]
